{
  "formatVersion": "v2-0.1",
  "systemId": "safran-space",
  "facts": [
    {
      "id": "safran-space-domains",
      "claim": "Activités spatiales de Safran : stations sol, communications embarquées, optiques spatiales, propulsion électrique, surveillance de l'espace, position-navigation-temps, instrumentation des lanceurs, lanceurs (ArianeGroup).",
      "status": "verified",
      "sources": [
        "safran-espace"
      ],
      "usedBy": [
        "tour.overview"
      ],
      "note": "Le système ne montre que quatre de ces domaines ; les horloges atomiques, la surveillance (WeTrack) et les équipements embarqués (harnais, moteurs de déploiement, capteurs inertiels) n'ont pas encore d'objet."
    },
    {
      "id": "arianegroup-jv",
      "claim": "ArianeGroup est une co-entreprise 50/50 de Safran et d'Airbus ; elle conçoit, produit et commercialise Ariane 6.",
      "status": "verified",
      "sources": [
        "safran-espace"
      ],
      "usedBy": [
        "card.launcher",
        "tour.launcher"
      ]
    },
    {
      "id": "ariane6-height",
      "claim": "Ariane 6 mesure de 56 à 62 m selon la coiffe.",
      "value": "56-62",
      "unit": "m",
      "status": "verified",
      "sources": [
        "esa-ariane6-made-of",
        "arianegroup-ariane6"
      ],
      "usedBy": [
        "card.launcher",
        "model:launcher"
      ]
    },
    {
      "id": "ariane6-core",
      "claim": "Étage central de 5,4 m de diamètre ; boosters P120C de 13,5 m de long et 3,4 m de diamètre.",
      "status": "verified",
      "sources": [
        "esa-ariane6-made-of",
        "esa-engines-qualified"
      ],
      "usedBy": [
        "model:launcher"
      ],
      "note": "Longueurs d'étages du modèle arrondies (étage central ≈ 30 m, étage supérieur ≈ 12 m, coiffe ≈ 20 m) : non sourcées, choisies pour retrouver 62 m."
    },
    {
      "id": "vulcain-thrust",
      "claim": "Le moteur Vulcain 2.1 de l'étage central délivre 1 371 kN de poussée dans le vide ; développé par ArianeGroup à Vernon.",
      "value": 1371,
      "unit": "kN",
      "status": "verified",
      "sources": [
        "esa-ariane6-engines",
        "esa-engines-qualified"
      ],
      "usedBy": [
        "card.launcher"
      ]
    },
    {
      "id": "pps5000-specs",
      "claim": "PPS 5000 (propulseur à plasma stationnaire, effet Hall, xénon) : puissance 2 500 à 5 000 W, poussée 150 à 300 mN, impulsion spécifique 1 730 à 2 000 s, divergence du jet 40°.",
      "status": "verified",
      "sources": [
        "pps5000-datasheet"
      ],
      "usedBy": [
        "card.telecom-satellite",
        "model:telecom-satellite"
      ],
      "note": "Retenu par Airbus (Eurostar Neo) et Thales Alenia Space (Spacebus Neo) pour la mise à poste et le maintien à poste."
    },
    {
      "id": "pps5000-weight",
      "claim": "Une poussée de 300 mN équivaut au poids d'une masse d'environ 31 g sur Terre.",
      "value": 30.6,
      "unit": "g",
      "status": "computed",
      "formula": "m = F / g, F = 0,300 N, g = 9,81 m/s² → m = 0,0306 kg",
      "sources": [
        "pps5000-datasheet"
      ],
      "usedBy": [
        "card.telecom-satellite"
      ]
    },
    {
      "id": "reosc-optics",
      "claim": "Safran Reosc fournit des optiques spatiales en verre, carbure de silicium (SiC) ou béryllium, jusqu'à 1,5 m ; miroirs SiC pour Spot 6 et 7, Gaia, Meteosat 3e génération, entre autres.",
      "status": "verified",
      "sources": [
        "reosc-space-optics",
        "safran-satellites"
      ],
      "usedBy": [
        "card.observation-satellite",
        "model:observation-satellite"
      ]
    },
    {
      "id": "elt-m2",
      "claim": "Safran Reosc a poli le miroir secondaire M2 de l'ELT, 4,2 m de diamètre, plus grand miroir secondaire de télescope jamais construit.",
      "value": 4.2,
      "unit": "m",
      "status": "verified",
      "sources": [
        "reosc-elt-2016"
      ],
      "usedBy": [],
      "note": "Pas encore utilisé : candidat pour une future fiche « optiques »."
    },
    {
      "id": "syrlinks-radio",
      "claim": "Safran (Syrlinks) fournit les émetteurs et transpondeurs des liaisons de télémesure, de télécommande et de transmission de données à haut débit.",
      "status": "verified",
      "sources": [
        "safran-satellites"
      ],
      "usedBy": [
        "card.observation-satellite",
        "model:observation-satellite"
      ]
    },
    {
      "id": "sds-antenna-sizes",
      "claim": "Antennes de poursuite Safran Data Systems de 2,4 à 13,5 m ; série ORION de 7,3 à 13,5 m pour les agences spatiales ; LEGION, antenne compacte d'environ 4 m.",
      "status": "verified",
      "sources": [
        "sds-antennas"
      ],
      "usedBy": [
        "card.tracking-station",
        "model:tracking-station"
      ]
    },
    {
      "id": "sds-tri-band",
      "claim": "Source tri-bande S/X/Ka brevetée par Safran sur les antennes ORION.",
      "status": "verified",
      "sources": [
        "sds-antennas",
        "safran-espace"
      ],
      "usedBy": [
        "card.tracking-station"
      ]
    },
    {
      "id": "diorama-scale",
      "claim": "Échelles du diorama : sol au 1/13,5 (1 unité = 13,5 m) pour le lanceur et la station ; satellites dessinés plus grands (≈ 1/5) et ailes solaires raccourcies ; altitudes non représentées.",
      "status": "verified",
      "sources": [],
      "usedBy": [
        "model:launcher",
        "model:tracking-station",
        "model:telecom-satellite",
        "model:observation-satellite"
      ],
      "note": "Convention de représentation, comme pour la scène Starlink."
    }
  ],
  "sources": [
    {
      "id": "safran-espace",
      "title": "Espace | Safran (présentation du groupe)",
      "url": "https://www.safran-group.com/fr/groupe/presentation/espace",
      "publisher": "Safran",
      "accessed": "2026-10-24",
      "access": "opened"
    },
    {
      "id": "safran-satellites",
      "title": "Safran à bord des satellites",
      "url": "https://web.safran-group.com/safran-on-board/fr/satellites.html",
      "publisher": "Safran",
      "accessed": "2026-10-24",
      "access": "opened"
    },
    {
      "id": "pps5000-datasheet",
      "title": "PPS®5000 — Stationary plasma thruster (fiche produit)",
      "url": "https://www.safran-group.com/sites/default/files/2022-11/Safran%20Spacecraft%20Propulsion%20-%20PPS5000-%20Datasheet.pdf",
      "publisher": "Safran Spacecraft Propulsion",
      "accessed": "2026-10-24",
      "access": "opened"
    },
    {
      "id": "reosc-space-optics",
      "title": "Systèmes Optiques pour l'Espace",
      "url": "https://www.safran-group.com/fr/produits-services/systemes-optiques-espace",
      "publisher": "Safran Reosc",
      "accessed": "2026-10-24",
      "access": "opened"
    },
    {
      "id": "reosc-elt-2016",
      "title": "Safran Reosc to polish M2 secondary mirror for Europe's giant new telescope, E-ELT (communiqué)",
      "url": "https://www.safran-group.com/pressroom/safran-reosc-polish-m2-secondary-mirror-europes-giant-new-telescope-e-elt-2016-07-13/pdf-download",
      "publisher": "Safran",
      "accessed": "2026-10-24",
      "access": "search-result"
    },
    {
      "id": "sds-antennas",
      "title": "LEGION, ORION, VISION, ARES — Antennes tri-bandes S/X/Ka de poursuite des satellites",
      "url": "https://www.safran-group.com/fr/produits-services/antennes-tri-bandes-sxka-poursuite-satellites-toutes-generations",
      "publisher": "Safran Data Systems",
      "accessed": "2026-10-24",
      "access": "opened"
    },
    {
      "id": "esa-ariane6-made-of",
      "title": "Ariane 6: what's it made of?",
      "url": "https://www.esa.int/Enabling_Support/Space_Transportation/Ariane/Ariane_6_what_s_it_made_of",
      "publisher": "ESA",
      "accessed": "2026-10-24",
      "access": "search-result"
    },
    {
      "id": "arianegroup-ariane6",
      "title": "Ariane 6, a versatile launcher for all missions",
      "url": "https://www.ariane.group/en/space-transportation/ariane-6",
      "publisher": "ArianeGroup",
      "accessed": "2026-10-24",
      "access": "search-result"
    },
    {
      "id": "esa-ariane6-engines",
      "title": "The engines of Ariane 6",
      "url": "https://www.esa.int/Enabling_Support/Space_Transportation/Ariane/The_engines_of_Ariane_6",
      "publisher": "ESA",
      "accessed": "2026-10-24",
      "access": "search-result"
    },
    {
      "id": "esa-engines-qualified",
      "title": "All engines for Ariane 6 complete qualification tests",
      "url": "https://www.esa.int/Enabling_Support/Space_Transportation/Ariane/All_engines_for_Ariane_6_complete_qualification_tests",
      "publisher": "ESA",
      "accessed": "2026-10-24",
      "access": "search-result"
    }
  ]
}
